product_name,product_href,product_new_price,product_old_price,product_discount
Кухонный стол Авалон-1 Белый,https://divan.ru/product/obedennyj-stol-avalon-1-belyj,9990,16 990,41
Кухонный стол Флекс Дуб Кельтик,https://divan.ru/product/kuhonnyj-stol-fleks-dub-keltik,9990,16 990,41
Стул барный Порш White,https://divan.ru/product/stul-barnyj-porsh-white,6690,11 990,44
Стул Шэлл Black,https://divan.ru/product/stul-shell-black,4490,7690,41
Стул Шерил Dark Blue,https://divan.ru/product/stul-sheril-dark-blue,13 690,24 490,44
Журнальный стол Нордик Light,https://divan.ru/product/jurnalnyj-stol-nordik-light,4990,9990,50
Стул Орли Textile Light,https://divan.ru/product/stul-orli-textile-light,9990,16 690,40
Кухонный стол Авалон-3 Дуб Золотистый,https://divan.ru/product/obedennyj-stol-avalon-3-dub-zolotistyj,10 990,19 990,45
Кухонный стол Реймонд Молочный,https://divan.ru/product/kuhonnyj-stol-rejmond-molochny,12 990,22 490,42
Стул Орли Velvet Blue,https://divan.ru/product/stul-orli-velvet-blue,9990,16 690,40
Стул Шэлл Red,https://divan.ru/product/stul-shell-red,4490,7690,41
Кухонный стол Авалон-1 Дуб Золотистый,https://divan.ru/product/obedennyj-stol-avalon-1-dub-zolotistyj,9990,16 990,41
Кухонный стол Авалон-3 Белый,https://divan.ru/product/obedennyj-stol-avalon-3-belyj,10 990,19 990,45
Стул Меган Velvet Light Blue,https://divan.ru/product/stul-megan-velvet-light-blue,6490,10 990,40
Стул барный Эрин Dark Blue,https://divan.ru/product/stul-barnyj-erin-dark-blue,15 990,27 290,41
Стул барный Порш Light Beige,https://divan.ru/product/stul-barnyj-porsh-light-beige,6690,11 990,44
Стул барный Эрин Velvet Mint,https://divan.ru/product/stul-barnyj-erin-velvet-mint,15 990,27 290,41
Стул Орли Velvet Emerald,https://divan.ru/product/stul-orli-velvet-emerald,9990,16 690,40
Стул Бон Red,https://divan.ru/product/stul-bon-red,3990,6690,40
Стул барный Эймс Sky,https://divan.ru/product/stul-barnyj-ejms-sky,5490,9690,43
Стул Торвальд Light Blue,https://divan.ru/product/stul-torvald-light-blue,7990,13 990,42
Стул Торвальд Green,https://divan.ru/product/stul-torvald-green,7990,13 990,42
Стул Орли Textile Grey,https://divan.ru/product/stul-orli-textile-grey,9990,16 690,40
Кухонный стол Реймонд Белый,https://divan.ru/product/kuhonnyj-stol-rejmond-belyj,12 990,22 490,42
Стул Тод Grey,https://divan.ru/product/stul-tod-grey,3290,5490,40
Стул Меган-1 Velvet Beige,https://divan.ru/product/stul-megan-1-velvet-beige,6490,10 990,40
Стул барный Порш Grey Fabric,https://divan.ru/product/stul-barnyj-porsh-grey-fabric,6990,11 990,41
Стул барный Порш Dark Grey Fabric,https://divan.ru/product/stul-barnyj-porsh-dark-grey-fabric,6990,11 990,41
Стул барный Порш Black,https://divan.ru/product/stul-barnyj-porsh-black,6690,11 990,44
Стул Крокус Sky,https://divan.ru/product/stul-krokus-sky,6490,11 290,42
Стул Булл White,https://divan.ru/product/stul-bull-white,4490,12 690,64
Стул барный Порш Light Grey,https://divan.ru/product/stul-barnyj-porsh-light-grey,6990,11 990,41
Стул Бон Yellow,https://divan.ru/product/stul-bon-yellow,3990,6690,40
Стул Меган Velvet Pink,https://divan.ru/product/stul-megan-velvet-pink,6490,10 990,40
Стул барный Порш Red,https://divan.ru/product/stul-barnyj-porsh-red,6990,11 990,41
Стул барный Лион Velvet Blue,https://divan.ru/product/stul-barnyj-lion-velvet-blue,6490,12 690,48
Стул барный Лион Brown,https://divan.ru/product/stul-barnyj-lion-brown,6490,11 290,42
Стул Ранч White,https://divan.ru/product/stul-ranch-white,4490,14 990,70
Стул барный Паскаль Vintage Brown,https://divan.ru/product/stul-barnyj-paskal-vintage-brown,5990,10 290,41
Стул Меган Velvet Black,https://divan.ru/product/stul-megan-velvet-black,6490,10 990,40
Стул Мира Textile Grey,https://divan.ru/product/stul-mira-textile-grey,6990,12 290,43
Стул Мира Velvet Grey,https://divan.ru/product/stul-mira-velvet-grey,6990,12 290,43
Стул Меган Velvet Purple,https://divan.ru/product/stul-megan-velvet-purple,6490,10 990,40
Стул барный Курт Purple,https://divan.ru/product/stul-barnyj-kurt-purple,6290,10 690,41
Стул Мира Velvet Pink,https://divan.ru/product/stul-mira-velvet-pink,6990,12 290,43
Стул Мира Velvet Ocean,https://divan.ru/product/stul-mira-velvet-ocean,6990,12 290,43
Стул Тод Pink,https://divan.ru/product/stul-tod-pink,3290,5490,40
Стул барный Курт White,https://divan.ru/product/stul-barnyj-kurt-white,6290,10 690,41
Журнальный стол Седар,https://divan.ru/product/jurnalnyj-stol-sedar,3290,9990,67
Журнальный стол Седар-1,https://divan.ru/product/jurnalnyj-stol-sedar-1,2690,7990,66
